{
  "schemaVersion": 1,
  "kind": "aas.selection-evidence",
  "digest": "sha256-fc056d38f9bca5de87e658f4da5868e93f3c0f2eb0756111f78f824d2ed99471",
  "payload": {
    "schemaVersion": 1,
    "kind": "aas.selection-evidence.payload",
    "project": {
      "schemaVersion": 1,
      "commit": "ef9b6fdbf7b6c27b41c1a63e2e3d7f9379e9eae8",
      "files": [
        {
          "path": "package.json",
          "size": 7351,
          "sha256": "sha256-78963f05e10f6780a2c1bf7eef0bcccd462a1d63578b86db7da9eb91b520a0de"
        },
        {
          "path": "tools/lib/aas-v1/mcp/server.js",
          "size": 35836,
          "sha256": "sha256-59eddf5f3ff052ab7eb35dd07b8879d59ee47a2db609d1027107ed687a37a055"
        },
        {
          "path": "tools/lib/aas-v1/search.js",
          "size": 5667,
          "sha256": "sha256-c74cabd5bb32907735ef8d24b9b29893580f8261db7e55c2cc7d1cea61e4501a"
        }
      ],
      "fingerprint": "sha256-89f499b97e63b2a10e7d82da4e1ce84f7c474e47a9071ae9c1cee6e568e4094e"
    },
    "catalog": {
      "package": "agentic-awesome-skills",
      "version": "16.7.0",
      "integrity": "sha256-1e464d8b3053b349fc16ba5a0f23a7aa4042802362a5a97604b9675846a22e27"
    },
    "manifestDigest": "sha256-00747b7401376c63bea313b561b16a665a5e6043629a98384296caefab0ce13c",
    "dimensions": [
      {
        "capabilityIds": [
          "runtime"
        ],
        "id": "architecture-runtime",
        "status": "applicable"
      },
      {
        "capabilityIds": [
          "javascript"
        ],
        "id": "languages-frameworks",
        "status": "applicable"
      },
      {
        "capabilityIds": [
          "retrieval"
        ],
        "id": "domain-behavior",
        "status": "applicable"
      },
      {
        "capabilityIds": [
          "json-fields"
        ],
        "id": "data-storage",
        "status": "applicable"
      },
      {
        "capabilityIds": [
          "mcp-client"
        ],
        "id": "external-integrations",
        "status": "applicable"
      },
      {
        "capabilityIds": [
          "tests"
        ],
        "id": "testing-quality",
        "status": "applicable"
      },
      {
        "capabilityIds": [
          "privacy"
        ],
        "id": "security-privacy",
        "status": "applicable"
      },
      {
        "capabilityIds": [],
        "id": "user-experience-accessibility",
        "status": "not-applicable"
      },
      {
        "capabilityIds": [
          "packaging"
        ],
        "id": "deployment-operations",
        "status": "applicable"
      },
      {
        "capabilityIds": [
          "maintenance"
        ],
        "id": "maintenance-workflow",
        "status": "applicable"
      }
    ],
    "capabilities": [
      {
        "dimensionId": "architecture-runtime",
        "evidence": [
          {
            "path": "tools/lib/aas-v1/mcp/server.js",
            "sha256": "sha256-59eddf5f3ff052ab7eb35dd07b8879d59ee47a2db609d1027107ed687a37a055"
          }
        ],
        "id": "runtime",
        "selectedSkillIds": [
          "mcp-builder"
        ],
        "status": "covered"
      },
      {
        "dimensionId": "languages-frameworks",
        "evidence": [
          {
            "path": "package.json",
            "sha256": "sha256-78963f05e10f6780a2c1bf7eef0bcccd462a1d63578b86db7da9eb91b520a0de"
          }
        ],
        "id": "javascript",
        "selectedSkillIds": [
          "javascript-pro"
        ],
        "status": "covered"
      },
      {
        "dimensionId": "domain-behavior",
        "evidence": [
          {
            "path": "tools/lib/aas-v1/search.js",
            "sha256": "sha256-c74cabd5bb32907735ef8d24b9b29893580f8261db7e55c2cc7d1cea61e4501a"
          }
        ],
        "id": "retrieval",
        "selectedSkillIds": [
          "invariant-guard"
        ],
        "status": "covered"
      },
      {
        "dimensionId": "data-storage",
        "evidence": [
          {
            "path": "tools/lib/aas-v1/mcp/server.js",
            "sha256": "sha256-59eddf5f3ff052ab7eb35dd07b8879d59ee47a2db609d1027107ed687a37a055"
          }
        ],
        "id": "json-fields",
        "selectedSkillIds": [
          "cross-platform-contract-propagation-audit"
        ],
        "status": "covered"
      },
      {
        "dimensionId": "external-integrations",
        "evidence": [
          {
            "path": "tools/lib/aas-v1/mcp/server.js",
            "sha256": "sha256-59eddf5f3ff052ab7eb35dd07b8879d59ee47a2db609d1027107ed687a37a055"
          }
        ],
        "id": "mcp-client",
        "selectedSkillIds": [
          "mcp-builder"
        ],
        "status": "covered"
      },
      {
        "dimensionId": "testing-quality",
        "evidence": [
          {
            "path": "package.json",
            "sha256": "sha256-78963f05e10f6780a2c1bf7eef0bcccd462a1d63578b86db7da9eb91b520a0de"
          }
        ],
        "id": "tests",
        "selectedSkillIds": [
          "javascript-testing-patterns"
        ],
        "status": "covered"
      },
      {
        "dimensionId": "security-privacy",
        "evidence": [
          {
            "path": "tools/lib/aas-v1/mcp/server.js",
            "sha256": "sha256-59eddf5f3ff052ab7eb35dd07b8879d59ee47a2db609d1027107ed687a37a055"
          }
        ],
        "id": "privacy",
        "selectedSkillIds": [
          "privacy-by-design"
        ],
        "status": "covered"
      },
      {
        "dimensionId": "deployment-operations",
        "evidence": [
          {
            "path": "package.json",
            "sha256": "sha256-78963f05e10f6780a2c1bf7eef0bcccd462a1d63578b86db7da9eb91b520a0de"
          }
        ],
        "id": "packaging",
        "selectedSkillIds": [
          "antigravity-maintainer-batch-release"
        ],
        "status": "covered"
      },
      {
        "dimensionId": "maintenance-workflow",
        "evidence": [
          {
            "path": "package.json",
            "sha256": "sha256-78963f05e10f6780a2c1bf7eef0bcccd462a1d63578b86db7da9eb91b520a0de"
          }
        ],
        "id": "maintenance",
        "selectedSkillIds": [
          "antigravity-maintainer-batch-release"
        ],
        "status": "covered"
      }
    ],
    "selectedSkillIds": [
      "mcp-builder",
      "javascript-pro",
      "invariant-guard",
      "cross-platform-contract-propagation-audit",
      "javascript-testing-patterns",
      "privacy-by-design",
      "antigravity-maintainer-batch-release"
    ],
    "processTrace": {
      "calls": [
        {
          "attempt": 1,
          "canonicalInputBytes": 37,
          "canonicalOutputBytes": 1190,
          "input": {
            "cursor": 0,
            "limit": 50,
            "query": "mcp"
          },
          "output": {
            "nextCursor": 50,
            "ok": true,
            "returnedSkillIds": [
              "accesslint-audit",
              "activecampaign-automation",
              "agent-harness-fault-injection",
              "agent-memory-mcp",
              "agent-qa-authoring",
              "agent-qa-debug-fix",
              "agent-qa-result-triage",
              "ai-dev-jobs-mcp",
              "airtable-automation",
              "amplitude-automation",
              "anti-deception",
              "antigravity-maintainer-batch-release",
              "antigravity-skill-orchestrator",
              "anywrite",
              "aomi-transact",
              "apple-notes-search",
              "asana-automation",
              "audit-agent-run-evidence",
              "automated-triage",
              "aws-agentic-ai",
              "aws-mcp-setup",
              "bamboohr-automation",
              "basecamp-automation",
              "bdistill-behavioral-xray",
              "bdistill-knowledge-extraction",
              "bilig-workpaper",
              "bitbucket-automation",
              "brevo-automation",
              "browser-testing-with-devtools",
              "bumblebee",
              "buywhere-product-catalog",
              "cal-com-automation",
              "calendly-automation",
              "canva-automation",
              "circleci-automation",
              "clarvia-aeo-check",
              "claude-in-chrome-troubleshooting",
              "clickup-automation",
              "close-automation",
              "coda-automation",
              "confluence-automation",
              "convertkit-automation",
              "copilot-sdk",
              "datadog-automation",
              "discord-automation",
              "docusign-automation",
              "dotnet-backend-patterns",
              "dropbox-automation",
              "ejentum-reasoning-harness",
              "event-staffing-compliance"
            ],
            "totalMatches": 145
          },
          "sequence": 1,
          "tool": "search_skills"
        },
        {
          "attempt": 1,
          "canonicalInputBytes": 44,
          "canonicalOutputBytes": 1025,
          "input": {
            "cursor": 0,
            "limit": 50,
            "query": "typescript"
          },
          "output": {
            "nextCursor": 50,
            "ok": true,
            "returnedSkillIds": [
              "api-sdk-generator",
              "aws-cdk-development",
              "aws-serverless-eda",
              "azure-ai-voicelive-ts",
              "azure-cosmos-ts",
              "azure-postgres-ts",
              "azure-storage-blob-ts",
              "azure-storage-file-share-ts",
              "azure-storage-queue-ts",
              "bilig-workpaper",
              "bullmq-specialist",
              "bun-development",
              "cc-skill-coding-standards",
              "cdk-patterns",
              "comfyui-gateway",
              "convex",
              "cypress-skill",
              "dbos-typescript",
              "drizzle-orm-expert",
              "expo-module",